{
  "$schema": "https://json-schema.org/draft/2020-12/schema",
  "type": "object",
  "properties": {
    "connection": {
      "type": "string",
      "pattern": "^[a-z][a-z0-9_-]{0,62}$"
    },
    "columns": {
      "type": "array",
      "items": {
        "type": "object",
        "properties": {
          "name": {
            "type": "string",
            "pattern": "^[^\\x00]*$"
          },
          "type": {
            "type": "string",
            "minLength": 1,
            "pattern": "^[^\\x00]+$"
          },
          "encoding": {
            "type": "string",
            "enum": [
              "base64",
              "postgres_text"
            ],
            "description": "Value representation marker; for PostgreSQL array results, describes the elements."
          }
        },
        "required": [
          "name",
          "type"
        ],
        "additionalProperties": false
      }
    },
    "rows": {
      "type": "array",
      "items": {
        "type": "array",
        "items": {}
      }
    },
    "row_count": {
      "type": "integer",
      "minimum": 0
    },
    "truncated": {
      "type": "boolean"
    },
    "elapsed_ms": {
      "type": "integer",
      "minimum": 0
    }
  },
  "required": [
    "connection",
    "columns",
    "rows",
    "row_count",
    "truncated",
    "elapsed_ms"
  ],
  "additionalProperties": false
}
